<!ELEMENT tienda (nombre,pokemon+)>
<!ELEMENT pokemon (nombre,tipo+,precio)>
<!ELEMENT nombre (#PCDATA)>
<!ELEMENT precio (#PCDATA)>
<!ELEMENT tipo (#PCDATA)>